{"author_form_results":[{"completion_status":"not_started","human_findings_recorded":false,"proposal_id":"EPIC-DEV-P27-CLEANER-FROM-CUPBOARD","reviewer_id_present":false},{"completion_status":"not_started","human_findings_recorded":false,"proposal_id":"EPIC-DEV-P27-UNWRAP-FROZEN-ITEM","reviewer_id_present":false},{"completion_status":"not_started","human_findings_recorded":false,"proposal_id":"EPIC-DEV-P28-ADD-ADJUST-STIR","reviewer_id_present":false},{"completion_status":"not_started","human_findings_recorded":false,"proposal_id":"EPIC-DEV-P28-DRY-HANDS-WITH-TOWEL","reviewer_id_present":false},{"completion_status":"not_started","human_findings_recorded":false,"proposal_id":"EPIC-DEV-P28-PEEL-POTATO","reviewer_id_present":false}],"calibration_rejection_count":2,"distribution_authorized":false,"errors":[],"future_test_eligible":false,"gate_a_eligible":false,"h1_assigned":false,"h2_assigned":false,"human_decision_count":0,"human_review_occurred":false,"identity_count":0,"manifest_validation_pass":true,"minimality_assigned":false,"necessity_assigned":false,"packet_id":"epic-dev-authoring-packets-v1","packet_status":"DRAFT_NOT_DISTRIBUTABLE","prescreen_results":[{"completion_status":"incomplete","exposure_event_count":0,"plan_id":"epic-dev-task171-P27_101-task153-plan","sample_count":6,"source_id":"P27_101","task153_readiness_token":"SEMANTIC_AV_SOURCE_PRESCREEN_REPAIR"},{"completion_status":"incomplete","exposure_event_count":0,"plan_id":"epic-dev-task171-P28_103-task153-plan","sample_count":6,"source_id":"P28_103","task153_readiness_token":"SEMANTIC_AV_SOURCE_PRESCREEN_REPAIR"}],"proposal_count":5,"readiness_token":"EPIC_DEV_AUTHORING_PACKETS_READY","record_type":"epic_dev_authoring_packet_import","schema_validation_pass":true,"schema_version":"1.0.0","semantic_firewall_pass":true,"source_count":2,"source_level_blindness_enforced":true}
